{
  "$schema": "https://json-schema.org/draft/2020-12/schema",
  "$id": "https://roamory.app/contracts/plan_request.schema.json",
  "title": "PlanRequest",
  "description": "The `request` part of POST /v1/plan. Thumbnails travel as separate multipart parts (see README).",
  "type": "object",
  "additionalProperties": false,
  "required": [
    "trip_id",
    "style",
    "trip_type",
    "destination",
    "start_date",
    "target_s",
    "effective_target_s",
    "clips"
  ],
  "properties": {
    "trip_id": {
      "type": "string",
      "minLength": 1
    },
    "style": {
      "$ref": "#/$defs/style"
    },
    "trip_type": {
      "type": "string",
      "minLength": 1,
      "description": "From the app's trip-type config list, e.g. honeymoon, family, friends, school."
    },
    "destination": {
      "type": "object",
      "additionalProperties": false,
      "required": [
        "country",
        "city"
      ],
      "properties": {
        "country": {
          "type": "string",
          "minLength": 1
        },
        "city": {
          "type": [
            "string",
            "null"
          ],
          "minLength": 1
        }
      }
    },
    "start_date": {
      "type": "string",
      "format": "date",
      "description": "Local date the trip started (YYYY-MM-DD). Lets the title use the month and year without inventing them."
    },
    "target_s": {
      "type": "number",
      "exclusiveMinimum": 0,
      "description": "The style preset's target_s.default."
    },
    "effective_target_s": {
      "type": "number",
      "exclusiveMinimum": 0,
      "description": "max(target_s, button clips x preset clip_s.min + preset end_card_s). Computed on the phone; see README."
    },
    "clips": {
      "type": "array",
      "minItems": 1,
      "items": {
        "$ref": "#/$defs/clip"
      }
    }
  },
  "$defs": {
    "style": {
      "type": "string",
      "enum": [
        "cinematic",
        "reels",
        "documentary",
        "vlog"
      ]
    },
    "clip": {
      "type": "object",
      "additionalProperties": false,
      "required": [
        "moment_id",
        "t_from_ms",
        "t_to_ms",
        "duration_s",
        "source",
        "event_type",
        "description",
        "score",
        "proposed_in_s",
        "proposed_out_s",
        "low_fps_lead_in_s",
        "thumbnail_count"
      ],
      "properties": {
        "moment_id": {
          "type": "string",
          "pattern": "^[A-Za-z0-9_-]+$",
          "description": "Also names the clip's thumbnail parts, so it is restricted to filename-safe characters."
        },
        "t_from_ms": {
          "type": "integer",
          "minimum": 0,
          "description": "Clip start on the trip clock (TRD 5.1). Used for chronological order."
        },
        "t_to_ms": {
          "type": "integer",
          "minimum": 0
        },
        "duration_s": {
          "type": "number",
          "exclusiveMinimum": 0,
          "description": "Length of clips/{moment_id}.mp4. Edit-spec trims must fall inside [0, duration_s]."
        },
        "source": {
          "type": "string",
          "enum": [
            "ai",
            "button",
            "local_fallback"
          ]
        },
        "event_type": {
          "type": [
            "string",
            "null"
          ],
          "enum": [
            "scenery",
            "landmark",
            "activity",
            "food",
            "social",
            "other",
            null
          ],
          "description": "From Stage 2. Null when the cloud never described the clip (local_fallback, or a button clip whose description failed)."
        },
        "description": {
          "type": [
            "string",
            "null"
          ],
          "maxLength": 200,
          "description": "Stage 2 description, only what is visible. Null under the same conditions as event_type."
        },
        "score": {
          "type": [
            "number",
            "null"
          ],
          "minimum": 0,
          "maximum": 1,
          "description": "S2 for ai clips, local score L for local_fallback, S2 or null for button clips."
        },
        "proposed_in_s": {
          "type": "number",
          "minimum": 0,
          "description": "Pre-pass best sub-window start, seconds from the clip file's start."
        },
        "proposed_out_s": {
          "type": "number",
          "exclusiveMinimum": 0
        },
        "low_fps_lead_in_s": {
          "type": "number",
          "minimum": 0,
          "description": "Seconds at the start of the clip file recorded below 30 fps (TRD 4.3). 0 if none. A speed ramp is allowed only inside this lead-in."
        },
        "thumbnail_count": {
          "type": "integer",
          "minimum": 0,
          "maximum": 4,
          "description": "Number of {moment_id}_{k}.jpg parts sent for this clip, k = 0..thumbnail_count-1."
        }
      }
    }
  }
}
