{
  "trip_id": "t_123",
  "style": "vlog",
  "trip_type": "honeymoon",
  "destination": {
    "country": "Japan",
    "city": "Kyoto"
  },
  "start_date": "2026-10-12",
  "target_s": 50,
  "effective_target_s": 50,
  "clips": [
    {
      "moment_id": "m_01",
      "t_from_ms": 120000,
      "t_to_ms": 152000,
      "duration_s": 32.0,
      "source": "ai",
      "event_type": "scenery",
      "description": "River winding between green hills",
      "score": 0.78,
      "proposed_in_s": 13.5,
      "proposed_out_s": 18.5,
      "low_fps_lead_in_s": 0,
      "thumbnail_count": 4
    },
    {
      "moment_id": "m_02",
      "t_from_ms": 600000,
      "t_to_ms": 632000,
      "duration_s": 32.0,
      "source": "ai",
      "event_type": "landmark",
      "description": "Red torii gates lining a stone path",
      "score": 0.86,
      "proposed_in_s": 13.5,
      "proposed_out_s": 18.5,
      "low_fps_lead_in_s": 0,
      "thumbnail_count": 4
    },
    {
      "moment_id": "m_03",
      "t_from_ms": 1500000,
      "t_to_ms": 1531000,
      "duration_s": 31.0,
      "source": "button",
      "event_type": "activity",
      "description": "Two people walking under paper lanterns",
      "score": 0.71,
      "proposed_in_s": 12.5,
      "proposed_out_s": 17.5,
      "low_fps_lead_in_s": 15.0,
      "thumbnail_count": 4
    },
    {
      "moment_id": "m_04",
      "t_from_ms": 2400000,
      "t_to_ms": 2432000,
      "duration_s": 32.0,
      "source": "ai",
      "event_type": "food",
      "description": "Bowl of ramen on a wooden counter",
      "score": 0.66,
      "proposed_in_s": 13.5,
      "proposed_out_s": 18.5,
      "low_fps_lead_in_s": 0,
      "thumbnail_count": 4
    },
    {
      "moment_id": "m_05",
      "t_from_ms": 3100000,
      "t_to_ms": 3132000,
      "duration_s": 32.0,
      "source": "ai",
      "event_type": "scenery",
      "description": "River between green hills under cloud",
      "score": 0.69,
      "proposed_in_s": 13.5,
      "proposed_out_s": 18.5,
      "low_fps_lead_in_s": 0,
      "thumbnail_count": 4
    },
    {
      "moment_id": "m_06",
      "t_from_ms": 3900000,
      "t_to_ms": 3930000,
      "duration_s": 30.0,
      "source": "button",
      "event_type": null,
      "description": null,
      "score": null,
      "proposed_in_s": 12.5,
      "proposed_out_s": 17.5,
      "low_fps_lead_in_s": 15.0,
      "thumbnail_count": 4
    },
    {
      "moment_id": "m_07",
      "t_from_ms": 4500000,
      "t_to_ms": 4532000,
      "duration_s": 32.0,
      "source": "local_fallback",
      "event_type": null,
      "description": null,
      "score": 0.88,
      "proposed_in_s": 13.5,
      "proposed_out_s": 18.5,
      "low_fps_lead_in_s": 0,
      "thumbnail_count": 4
    },
    {
      "moment_id": "m_08",
      "t_from_ms": 5200000,
      "t_to_ms": 5234000,
      "duration_s": 34.0,
      "source": "ai",
      "event_type": "landmark",
      "description": "Wooden temple hall on a hillside",
      "score": 0.81,
      "proposed_in_s": 14.5,
      "proposed_out_s": 19.5,
      "low_fps_lead_in_s": 0,
      "thumbnail_count": 4
    },
    {
      "moment_id": "m_09",
      "t_from_ms": 6000000,
      "t_to_ms": 6032000,
      "duration_s": 32.0,
      "source": "ai",
      "event_type": "activity",
      "description": "Hands folding paper at a workshop table",
      "score": 0.63,
      "proposed_in_s": 13.5,
      "proposed_out_s": 18.5,
      "low_fps_lead_in_s": 0,
      "thumbnail_count": 4
    },
    {
      "moment_id": "m_10",
      "t_from_ms": 6900000,
      "t_to_ms": 6932000,
      "duration_s": 32.0,
      "source": "ai",
      "event_type": "scenery",
      "description": "Bamboo grove with light through the stalks",
      "score": 0.84,
      "proposed_in_s": 13.5,
      "proposed_out_s": 18.5,
      "low_fps_lead_in_s": 0,
      "thumbnail_count": 4
    },
    {
      "moment_id": "m_11",
      "t_from_ms": 7800000,
      "t_to_ms": 7832000,
      "duration_s": 32.0,
      "source": "ai",
      "event_type": "social",
      "description": "Two people sharing tea at a low table",
      "score": 0.72,
      "proposed_in_s": 13.5,
      "proposed_out_s": 18.5,
      "low_fps_lead_in_s": 0,
      "thumbnail_count": 4
    },
    {
      "moment_id": "m_12",
      "t_from_ms": 8600000,
      "t_to_ms": 8632000,
      "duration_s": 32.0,
      "source": "ai",
      "event_type": "scenery",
      "description": "City lights seen from a hilltop at dusk",
      "score": 0.8,
      "proposed_in_s": 13.5,
      "proposed_out_s": 18.5,
      "low_fps_lead_in_s": 0,
      "thumbnail_count": 4
    }
  ]
}
